0,6,5.8,7.333333333,3.333333333,5.333333333,5.15,1,1,1,8,8,3,5,6,5,3,8,7,6,8,2,4,7,7,3,7,1,8,1,3,1,1,1,3.967,3.967,9.043,1,1,16.537,16.537,17.922,1,3,17.198,32.335,34.232,2,6,27.722,32.57,34.74,2,4,20.925,21.509,23.054,2,4,18.78,18.78,21.406,1,1,9.653,9.653,10.455,1,5,25.447,25.447,26.08,1,3,19.559,19.559,21.569,1,3,13.523,13.523,14.284,1,5,19.423,19.423,20.36,1,5,44.446,46.086,46.592,2,1,1,4,7,6,3,7,6,2,7,3,5,7,5,4,1,6,5,6,8,7,4,1,28.266,59.827,60.14,9,5,1,Demand,1,a few slices a month,1,2.994,32.171,32.677,6,3,1,Tickets are expensive and travel is as well.,1,I don't watch football.,1,1.684,73.493,74.062,10,3,1,Distance,3,Drive 40 miles round trip 5 times weekly.,1,1.299,37.073,37.651,10,9,1,"Ease of use, or need for multiple viewers.",2,A few hours a week.,1,7.613,41.918,43.928,7,8,1,"Younger generations growing up with the technology, as older generations pass away.",1,I use both daily.,1,6.802,41.714,42.509,10,4,1,"Quick, easy measurements, with uniform taste.",1,I don't drink coffee.,1,1,3,32000,n/a,white,26,6,1,1,No.,Commonly held conceptions of activities of the average United States citizen.,Something with psychology maybe?  Hard to tell.,None.,1,1
0,5,5.4,6.333333333,4.333333333,5.333333333,4.25,1,1,1,6,7,1,4,9,5,3,3,6,6,2,5,7,9,8,3,7,1,8,1,3,1,1,7,6.512,6.512,9.664,1,1,15.577,15.577,16.859,1,1,13.554,13.554,14.222,1,6,12.886,12.886,13.849,1,5,14.314,14.314,15.228,1,8,22.467,25.424,26.898,2,1,20.341,20.341,24.006,1, ,0,0,60.044,0,1,10.846,10.846,25.749,1,2,21.018,21.018,22.025,1,8,12.321,19.473,27.568,2,8,30.327,30.327,32.079,1,1,1,5,6,5,4,6,7,6,7,1,6,3,4,7,5,7,6,6,4,3,9,1,40.934,66.612,67.249,5,5,1,Ingredient prices and consumer demand.,1,We order pizza about one every other week.,1,51.358,91.989,97.608,7,5,1,The expense of tickets.,3,"I watch occasionally, usually a ""big game"" such as the Superbowl or our local college team.",1,16.738,49.33,50.271,5,3,1,Lack of safe bicycle lanes/paths.,2,I carpool with my spouse.,1,24.922,78.919,79.515,5,7,1,The unwillingness of people to (1) pay for cable; (2) schedule their lives around the TV schedule.,3,"I watch at least 14 hours of TV per week, sometimes more.  I watch shows via DVR almost exclusively.",1,19.27,63.226,64.017,5,7,1,"Increase of population in general, and younger generation more used to/dependent on computer usage.",1,I use both multiple times every day.,1,17.983,71.275,72.018,8,5,1,"Convenience, and ability to select a different blend/flavor with each cup.",3,"I use a single cup brewer at home, and a drip machine at work.  I drink at least 2 cups of coffee per day.",1,2,6,140000,None,White,39,1,1,1,The pattern recognition was much more difficult than I would have expected.,I have no idea.,"I'm sure there is - otherwise it makes no sense.  Perhaps the study was about people's comprehension of different types of information?  Visual vs. written, for example.",No.,1,1
0,3,6.066666667,6,3.333333333,4.666666667,5.1,1,1,1,6,7,8,7,6,7,3,2,8,8,6,7,3,7,6,3,7,1,8,1,3,1,1,7,8.529,8.529,10.037,1,5,6.262,6.262,7.602,1,7,11.371,11.371,12.695,1,6,11.692,11.692,13.816,1,7,7.346,7.346,11.623,1,6,2.109,2.109,2.953,1,5,13.865,14.385,14.694,2,5,4.638,4.638,5.227,1,5,8.413,10.829,11.394,4,7,12.201,12.201,13.086,1,2,4.81,5.538,5.893,2,3,2.825,2.825,3.597,1,1,1,5,5,5,4,4,5,5,5,4,5,5,4,4,5,4,5,3,5,5,5,1,2.791,19.175,20.573,8,5,1,mass production,3,quick,1,2.211,8.731,12.033,6,4,2,no idea,2,never,1,4.429,16.909,23.387,5,3,1,"lazy, safety concerns",3,drive daily,1,2.7,23.459,23.955,9,5,1,"convenience, lazy culture",4,dont watch much,1,6.992,30.936,42.43,8,8,1,"convenience, connectivity",4,I use email mostly for work. Internet at home for surfing and facebook,1,3.692,19.764,20.194,8,3,1,busy scheduels,2,every two days,1,2,5,53000,christian,white,27,5,1,1,just long,i dont know,not sure, ,1,1
0,3,6.8,6.333333333,7,6.666666667,4.55,1,1,1,8,7,7,4,7,8,7,7,6,7,7,6,7,7,7,3,7,1,2,1,3,1,1,7,4.39,4.39,5.207,1,8,2.007,2.007,3.201,1,8,11.641,11.641,12.887,1,8,5.733,5.733,11.607,1,3,3.272,3.272,4.11,1,6,3.528,3.528,4.378,1,1,20.289,20.289,21.355,1,3,3.828,3.828,4.507,1,3,4.183,4.183,7.143,1,2,2.786,2.786,5.674,1,4,5.474,5.474,6.427,1,1,5.475,6.386,9,2,1,1,6,4,3,7,6,5,6,8,4,4,6,5,7,5,6,6,5,7,6,7,1,19.405,38.268,38.672,6,6,2,gas prices,1,every now and then,1,6.181,20.916,32.043,5,8,1,easier to watch on tv,1,a lot,1,7.458,20.329,20.841,5,7,1,cars are easier,1,every day,1,10.789,25.499,26.319,7,6,2,people want it,1,few hours a day,1,11.439,23.198,27.326,5,7,1,people want information,1,once a day,1,12.136,24.287,29.883,6,6,2,easier,1,dont drink coffee,1,1,3,45000,christian,black,30,1,1,1,no,american's habits,maybe,no,1,1
0,2,8,7,5.666666667,6.333333333,6.45,1,1,1,8,9,9,9,8,9,7,8,9,8,7,7,8,8,6,3,7,1,8,1,3,1,1,7,6.297,6.297,6.789,1,1,10.74,11.188,11.689,2,7,13.202,13.202,13.83,1,1,5.233,5.233,6.174,1,5,2.372,4.99,5.521,3,4,8.181,8.181,8.779,1,6,5.449,5.879,6.147,2,6,4.411,4.411,5.01,1,8,3.361,3.361,3.999,1,4,2.999,3.214,3.73,2,7,6.922,6.922,7.463,1,3,4.212,4.212,4.864,1,1,1,3,9,7,3,5,9,9,3,7,6,9,9,6,6,9,5,9,4,9,8,1,4.362,31.129,31.462,5,5,1,The cost of the ingredients.,3,I eat pizza a couple of times a month. Sometimes we buy frozen pizza and sometimes we go out.,1,17.912,48.099,62.167,5,5,1,Because people can't afford to see the games in person.,2,I watch games every now and then on television if other people are. I'm not generally a big football fan.,1,21.681,60.298,60.607,6,4,1,"Because there aren't enough safe roads that they can ride their bikes on (ie to get to work they have to take the interstate), and many people commute many miles.",4,I commute to and from work every day (30 minutes each way).,1,40.811,85.083,85.331,7,7,1,"Devices such as televisions and tablets are becoming more affordable, allowing more people to use them.",1,"I generally watch television at night when I am eating dinner. Maybe a couple of hours. I don't watch a lot of shows, there are only shows that interest me. I watch a lot of netflix.",1,4.568,38.513,38.985,6,9,1,The internet is becoming more available to populations that aren't within large cities.,2,I use the internet and email every single day at work. I also use it at home. I search the internet for entertainment purposes.,1,29.603,69.948,70.523,6,8,1,"More people are on the go and don't have time to sit at home and wait for a whole pot of coffee to brew. More people also live alone, negating the need for a whole pot of coffee.",2,"I drink at least one cup of coffee every morning, and more on the weekends.",1,2,4,65000,christian,caucasian,31,7,1,1,no,i have no idea,i dont know, ,1,1
0,6,6.333333333,7.333333333,6,6.666666667,5.4,1,1,1,6,7,6,7,6,7,5,6,6,2,8,8,7,7,7,3,7,1,8,1,3,1,1,1,1.37,5.832,6.95,2,1,2.048,18.06,20.856,2,3,2.036,30.329,35.286,2,6,17.509,20.562,24.005,2,2,17.167,17.167,18.874,1,3,47.447,57.682,60.018,2,5,1.382,32.466,36.685,2,2,35.568,35.568,40.14,1,3,19.062,19.062,37.269,1,2,18.935,18.935,22.847,1,6,40.654,40.654,42.437,1,2,15.075,15.075,16.817,1,1,1,3,5,7,4,7,6,5,6,4,7,5,7,6,6,7,4,2,3,7,5,1,53.171,75.756,98.798,7,6,2,"Where you're getting it from, prices of ingredients, and demand.",4,I rarely consume pizza.,1,44.849,180.827,182.287,7,8,1,"The expense of tickets, travel, and accommodations. It is also easier to follow the game on TV. It is more convenient to watch on TV.",4,I watch it on TV.,1,67.935,126.391,183.42,7,4,1,"Many cities are not pedestrian or bike friendly. It takes longer than driving, is less comfortable, and is not convenient in certain weather.",4,"I drive as a method of traveling between cities. I normally take the bus or walk, but my community is very centralized around a college campus.",1,3.084,264.359,265.483,9,8,1,Advancements in technology that is affordable and available to the general population.,3,"I watch a couple of hours of programming a week depending on available free time and the kind of programming that is airing. During sporting championship series I watch more TV, or if there's a movie on that I like.",1,75.458,109.293,145.079,6,8,1,"Internet is more readily available across different platforms - smart phones, tablets, iPods, etc.",2,"I check my email everyday, and search for something at least once almost everyday.",1,156.639,186.115,189.56,5,6,1,It's convenience.,4,"I drink coffee, or coffee with milk, almost every day.",1,2,4,11000,Roman Catholic,White Hispanic,23,6,1,1,No.,Comprehension and attitudes,Yes. Some connection between English nativeness and perceptions,No.,1,1
0,2,6.333333333,5.666666667,5,5.333333333,5.35,1,1,1,6,7,6,6,7,6,7,7,5,6,7,6,6,7,6,3,7,1,8,1,3,1,1,7,7.217,7.217,12.81,1,5,7.223,7.223,8.4,1,7,24.39,24.39,25.36,1,6,27.931,27.931,40.26,1,5,47.492,47.492,50.677,1,4,23.598,23.598,26.888,1,5,11.795,11.795,13.637,1,6,30.388,30.388,31.309,1,3,44.518,44.518,45.488,1,7,27.464,27.464,28.418,1,8,12.758,12.758,15,1,1,16.017,16.017,17.914,1,1,1,6,7,6,3,2,6,4,3,4,5,6,6,7,6,5,6,5,4,6,6,1,21.26,119.94,120.566,5,7,2,"The current price of pizza is based upon the ingredients to make such, along with the demand for pizza.",4,"Pizza is a wonderful food.  It is diverse in that one can change the toppings and crust type.  I eat pizza typically two, maybe three times a month.",1,18.111,113.966,114.809,6,5,1,I think that the cost of tickets contributes to the lower percentage of persons actually watching a live game.  There is also a time and location hinderance.  Not everyone can attend a live game.,3,I do not like football.  I do not watch football.,1,35.945,141.177,143.324,6,5,1,"Work attire is important.  I think few Americans ride their bikes to work due to several factors: weather, the physical exertion, and traffic related factors.",2,I drive a car.  I do not own a bicycle.,1,47.7,185.548,187.167,6,4,1,"On demand services accounts for the the growing number of available devises to watch video.  Shows can be recorded and played back to accomodate the consumer's schedule, not the broadcaster's.",4,"I have a television, but do not watch it.  We have an antenna but no converter box.  Most of our viewing of movies, shows, etc. comes through the internet.",1,46.553,206.105,206.939,6,6,1,"We have not had the internet for a long time.  Overall, it is a fairly new invention.  These days, children are almost raised with an electronic unmbilical cord via the internet, computers, cell phones, etc.  It is like second nature.  This being the case, the internet's recent rise in popularity will continue to grow.",2,I typically utilize both email and internet searches on a daily basis.,1,122.536,249.624,251.363,5,5,1,"Typically, when making a pot of coffee, some coffee gets wasted.  The single cup brew coffee makers make only one cup at a time and there is not much waste.  The coffee is always fresh and hot too.",4,My coffee drinking habit is typically two 6 ounce cups in the morning made from a drip coffee pot.,1,2,3,9000,None,Caucasian,47,5,1,1,The sequence of articles asserting percentages followed by the shape games seemed to focus on predicting outcomes based upon patterns.  This was a bit similar.  I did not find it to be odd or confusing.,I think you were studying prediction perspecives based upon patterns.,I think there was a strong similarity between the percentage articles and then the pattern games.  I think there was twelve of each.,The survey format was well laid out and easy to complete.  This was entertaining.  Thank you.  Best wishes on your study.,1,1
0,5,6.2,5,3.666666667,4.333333333,5.8,1,1,1,9,8,7,5,3,5,8,8,8,4,3,7,4,7,7,3,7,1,8,1,3,1,1,7,23.802,23.802,25.793,1,1,59.782,59.782,59.997,1,3,18.729,18.729,21.241,1,6,18.47,18.47,20.464,1,1,21.185,21.185,22.062,1,3,19.043,19.043,19.981,1,4,26.067,26.067,27.191,1,7,14.23,14.23,20.958,1,6,18.558,18.558,19.457,1,3,12.329,23.589,24.566,2,2,17.608,17.608,21.403,1,5,20.539,20.539,22.797,1,1,1,3,2,3,7,1,7,5,4,7,3,3,8,2,6,5,5,6,5,9,3,1,43.599,159.609,160.123,9,4,1,I think cause its pretty cheap and you can fill an average family with a large pizza.,1,I eat pizza atleast twice a month,1,73.018,185.74,191.735,6,5,2,Because its very expensive to go see a football game live.,1,Thru tv at home or a bar.,1,13.982,73.908,87.583,5,3,2,Lazy,1,I drive almost everywhere in my car but atleast 2% of that is on my bike.,1,15.164,102.979,103.406,7,3,1,Technology is growing so fast everyday something new is right around the corner.,1,atleat 4 hours a day.,1,6.558,143.7,144.289,8,8,1,thers a whole new generation thats growing and they are born into this technology.,1,I am logged on atleast 10 hrs a day either thru my pc or my smart phone,1,10.253,154.222,156.418,10,3,1,Its quick and easy,1,I stop drinking coffee over 2 yrs ago but when I did I WOULD DRINK ATLEAST  CUPS A DAY.,1,1,3,42000,n/a,n/a,38,5,1,1,connecting the shapes was a little hard for only minute of time,not sure I thought it was to understand psychology but than the questions threw me off.,yes but i don't know what it is,none at this time,1,1
0,1,6.466666667,6.666666667,5.333333333,6,3.5,1,1,1,5,7,7,4,8,8,6,7,8,6,5,5,5,8,8,3,7,1,8,1,3,1,1,7,5.482,5.482,8.163,1,2,10.309,10.309,11.75,1,5,11.088,11.088,12.193,1,8,18.007,22.369,23.338,2,8,13.298,13.298,14.346,1,3,15.957,15.957,17.298,1,6,14.573,14.573,21.905,1,3,6.194,6.194,10.22,1,5,16.849,16.849,17.892,1,3,9.34,9.34,14.68,1,4,10.163,10.163,11.861,1,7,17.282,17.282,18.773,1,1,1,5,1,4,8,9,7,4,7,1,8,7,4,7,2,5,9,9,6,9,8,1,39.261,97.961,123.304,6,7,1,It's the perfect food.,2,Every Saturday night is video gaming night with friends and family so Saturdays are Pizza night.,1,64.685,98.586,99.565,4,5,1,They can't afford the tickets,1,I hate football or any other sport for that matter.,1,70.348,119.36,120.11,6,3,1,Their lazy,1,I carpool to work most days,1,7.021,113.162,113.855,5,8,1,The drive to own the newest and best technology,4,I hate the direction American TV has gone in. I DON'T care about reality TV. I usually end up watching Anime or Asian dramas because they still actually do TV in a good format. Not reality tv.,1,93.072,121.586,122.375,5,5,1,Not sure,1,I only use them for work.,1,9.542,29.593,36.117,5,8,1,No left overs to throw away,3,Twice a day,1,2,4,45000,Agnostic,Hispanic,39,4,1,1,nope,not sure,nope,Thank you and good luck,1,1
0,2,4.933333333,7,4.666666667,5.833333333,3.6,1,1,1,5,6,8,2,2,2,2,6,6,7,8,4,6,6,4,3,7,1,8,1,3,1,1,7,11.226,19.214,22.592,4,5,19.918,30.182,32.146,2,8,25.823,25.823,29.256,1,8,34.292,34.292,35.939,1,8,38.368,38.368,48.297,1,1,30.576,33.086,34.819,3,1,24.792,24.792,35.483,1,3,22.556,22.556,30.029,1,7,43.549,43.549,45.772,1,3,17.264,17.264,18.717,1,7,14.868,14.868,16.102,1,6,26.606,26.606,30.648,1,1,1,3,1,4,3,7,2,1,5,1,9,4,2,4,1,7,4,6,4,4,8,1,22.523,116.729,119.309,8,4,2,"The over saturation of the market with pizza places. Also, the cost of ingredients along with transporting these ingredients.",2,Once a week on average I get it.,1,18.076,85.021,86.019,6,5,1,Price of tickets and drive time.  It's much nicer to sit in your house than go to a stadium where everything is overpriced.,3,Big games and playoffs usually.,1,40.885,119.464,172.385,9,3,1,"Laziness.  And it is much easier to get in a car and drive.  Commute time as well.  It would take too long if someone has a substantial commute, which most people do.",3,"I drive everywhere.  I plan on buying a bike this summer for work though.  I luckily live nearby.  But as far as groceries, etc, I drive constatntly.",1,35.012,123.733,125.565,6,8,1,"There is money in making the devices, so more companies put out products and they have to stand out, so the devices become more frequent.",4,I have a few shows at a time I watch online.  5-6 hrs per week.,1,234.274,300.323,346.721,6,9,1,"You can't do anything without the internet for a lot of things.  The younger generation that grew up on it uses it constantly, while the older generations are dying out.",1,I don't use search engines primarily; I usually know the sites I will go to.  I have my personal and work email up in a browser all day.,1,17.197,58.101,58.804,7,6,1,Simplicity.  You only have to make one serving at it takes a few seconds.,3,Cup or two in the morning.,1,1,4,75000,none,white,35,3,1,1,Not particularly.,How different people account for consumer habits.,"I assume so, but I can't think of the ulterior motive.",I do not.,1,1
0,1,8,5,5.666666667,5.333333333,4.8,1,1,1,6,5,9,9,9,8,9,7,7,9,7,8,9,9,9,3,7,1,8,1,3,1,1,7,17.52,17.52,18.852,1,8,13.166,13.166,14.205,1,5,13.702,13.702,15.064,1,8,16.954,16.954,17.474,1,7,13.201,13.201,14.346,1,5,14.321,14.321,16.126,1,8,5.87,5.87,6.407,1,2,9.75,9.75,11.478,1,8,6.591,6.591,9.583,1,3,6.998,6.998,8.679,1,2,40.196,40.196,42.681,1,8,10.029,10.029,10.736,1,1,1,7,9,5,8,7,6,5,5,3,6,2,6,9,8,8,6,7,4,9,4,1,46.737,124.387,125.482,5,2,1,The laziness of Americans who don't cook and that have a lot of money.,4,I love pizza but I refuse to eat it more than once a month.,1,14.888,137.972,152.8,7,9,2,I think that the price for live football tickets are still too high for most Americans to purchase.,2,I view every football game and Superbowl every year?,1,36.682,97.389,99.012,5,5,1,Since Americas are getting better jobs they are able to afford cars to drive to work.,4,I drive to work and school only.,1,34.585,99.648,163.674,5,4,1,I believe that researchers and developers are the main cause of the growth of devices being built.,4,"I watch TV about 5 hours a week, including movies.",1,64.574,197.697,198.781,5,9,1,The reasons why internet use in America is increasing because of the constant web updates and technology that keeps being produced that uses internet. Plus its very easy to use the internet whenever available.,1,I use the internet and email on a daily basis.,1,6.446,69.788,70.364,5,3,1,The success of one cup is giving an adult the energy to focus on any task necessary.,4,I drink coffee daily.,1,2,3,30000,Catholic,Hispanic,24,2,1,1,No I understood the question.,How the participants read questions carefully and viewing the opinion of the American people.,No I believe this survey was on point :),No I liked this survey very much!,1,1
0,6,5.333333333,5.333333333,4,4.666666667,5.2,1,1,1,6,4,6,5,5,7,4,4,6,6,6,6,5,5,5,3,7,1,8,1,3,1,1,7,6.401,12.242,17.504,2,1,27.588,27.588,29.579,1,3,43.472,43.472,44.783,1, ,0,0,60.007,0,5,22.24,25.513,30.023,2,7,12.093,12.093,25.991,1,5,23.658,23.658,25.139,1,5,21.348,29.845,31.142,2,1,31.52,40.301,43.16,2,2,24.411,28.72,50.718,2,6,28.25,32.664,33.908,2,7,37.892,54.457,59.241,2,1,1,5,6,6,4,6,5,6,5,4,4,5,5,4,4,6,5,4,3,5,4,1,12.48,138.09,139.088,5,5,1,fair,3,1 a month,1,6.18,41.252,42.546,6,5,1,ticket price,3,none,1,6.7,33.843,35.615,6,2,2,lack of infrastructure,4,rarely driving,1,7.516,47.412,53.365,5,5,1,peer pressure,3,no tv,1,14.967,34.672,41.439,5,6,1,availability,2,daily,1,10.932,45.734,46.775,6,5,2,laziness,3,quit coffe a few months ago,1,2,3,60000,agnostic,caucasian,34,3,1,1,no,manipulation,manipulation,no,1,1
0,5,5,4.333333333,2.333333333,3.333333333,4.85,1,1,1,7,5,1,5,5,5,5,1,7,8,3,6,6,5,6,3,7,1,8,1,3,1,1,7,3.951,3.951,4.761,1,1,11.036,11.036,12.645,1,1,12.345,12.345,13.541,1,4,24.894,32.362,33.032,2,2,14.285,14.285,22.733,1,3,17.89,17.89,34.459,1,1,16.762,16.762,19.777,1,7,21.26,21.26,22.63,1,6,22.921,22.921,24.175,1,4,15.177,16.426,17.562,3,6,24.372,27.308,28.38,2,7,22.846,23.569,24.323,2,1,1,3,7,5,7,6,6,7,6,2,5,4,4,6,2,3,3,6,7,4,2,1,23.534,46.43,50.661,6,1,1,Capitalism.,2,"I like pizza, but I prefer making pizza at home from scratch rather than ordering it.",1,37.504,56.71,78.15,6,4,1,"It's easier to sit on your couch at home, and game tickets are expensive. I suppose being able to have parties with friends is also a factor, but I dunno.",2,I don't.,1,26.268,166.178,166.691,5,1,1,"I think it's a combination of a lot of things. It would depend on the area; the area I grew up was not a safe place to ride bikes, due to high traffic, no space on the side of the rode to be passed in, and very hilly. The weather would also be a factor - if it was freezing most of the year, or often had precipitation, I wouldn't want to dress nicely to work. Also, for women who wear dresses and skirts, it might not be practical. It's also difficult to carry a briefcase on a bike. But the major reason is laziness.",3,"I both drive to work, and take the bus, depending on the day and which site I'm going to. If I got to the usual office, I take the bus. On days where I need to attend meetings elsewhere, I drive there.",1,45.803,84.35,85.092,5,3,1,"People keep buying them, so why not keep making them? Capitalism, folks.",2,"I will have the TV on while doing other tasks, mostly for background noise. I listen to books on tape just as often.",1,140.201,185.183,185.981,6,9,1,"There are more ways to use the internet, and it's cheaper. Also the internet is pretty awesome.",2,"All the interwebs forever! /  / I communicate with email for work and school, and I'm great at searching the internet.",1,19.92,61.591,61.977,9,2,1,It's easier. Current society is all about convenience and instant gratification.,4,"I drink too much coffee, but I brew a whole pot and use it for a few days.",1,2,3,10000,none,caucasian,22,2,1,1, ,i have no idea,"yes, but i really don't know",no,1,1
0,7,7.866666667,7,6,6.5,5,1,1,1,9,9,9,5,9,5,9,1,8,9,9,9,9,9,9,3,7,1,8,1,3,1,1,7,4.162,7.215,27.844,2,1,7.948,7.948,24.499,1,3,1.893,36.893,42.424,2,6,41.479,51.781,60.009,2,2,23.1,23.1,56.385,1,7,54.407,54.407,59.993,1, ,0,0,60.011,0,5,35.946,55.188,59.986,3,6,43.022,43.022,60.003,1,4,26.635,51.023,57.57,2,6,17.684,33.332,42.973,2,3,55.541,55.541,60.008,1,1,1,5,5,5,5,5,5,5,5,5,5,5,5,5,5,5,5,5,5,5,5,1,61.201,163.139,234.123,6,3,1,"I don't even know what the current prices are, because I don't eat it. Last time I had it, someone brought it over, about 4 years ago. If they're high, it's probably because of consumer demand.",4,"Don't eat it for a number of reasons: GMO cheese, GMO flour, GMO tomatoes, high salt content, fattening.",1,3.869,240.2,245.16,6,7,1,"Too expensive, too far, too cold.",4,"I don't watch it. BTW, somebody should check out those statistics on females. I have a sneaking suspicion that the reason 55% of women watch it is related to their husbands/boyfriends, such as they watch together. If they were single like me, would they still watch?",1,2.171,135.049,220.047,6,9,1,"It's too far. But that's no reason to create sustainable communities where people live like rats. Sorry, but I still believe in commuting to work.",4,I don't commute and mostly use the car to go shopping.,1,81.881,285.154,290.103,9,9,1,Consumer demand,4,"During daylight savings time, I probably watch a couple hours every night. When it gets dark early, I'll watch more. It varies. I'll watch a DVD once or twice a week usually.",1,72.568,187.681,190.532,5,9,1,"Older adults have picked up usage, such as Baby Boomers and X'ers.",1,"I check email daily multiple times and google whenever I want to find information. Sometimes, it's for buying something and other times it's just for information.",1,69.82,90.567,126.442,5,2,1,"It's convenient and fast, easier to clean, no leftovers.",4,Don't drink it.,1,2,6,2500,Christian,white,57,8,1,1,no,If rational exercises clarified thinking,"Yes. Perhaps, to expose our own lack of logical thinking when it comes to certain activities.","I'm on dial up, so my time was a bit shortened on the beginning exercises. Thanks, & Jesus Bless.",1,1
0,2,6.066666667,5.666666667,3.333333333,4.5,5.8,1,1,1,8,7,3,4,8,7,7,5,5,7,7,7,5,7,4,3,7,1,8,1,3,1,1,7,23.714,23.714,26.593,1,4,32.431,37.542,40.054,2,8,36.55,36.55,40.717,1,4,22.304,22.304,24.239,1,5,18.264,18.264,19.766,1,8,37.516,37.516,39.659,1,4,18.764,18.764,22.412,1,5,29.37,32.523,33.464,2,5,17.702,17.702,21.917,1,7,17.823,17.823,25.373,1,7,14.231,26.727,28.106,2,3,8.114,8.114,10.268,1,1,1,5,2,5,2,7,7,7,2,4,3,5,5,2,9,5,5,3,3,8,5,1,8.931,50.938,72.852,6,7,1,People love the taste of pizza.,3,Very often. Twice a week.,1,111.862,205.682,207.996,5,3,2,It cost too much money.,2,Not very often. It is a violent sport.,1,35.498,66.225,177.139,6,3,1,It is more easy to drive a car.,2,I take the bus.,1,22.536,102.02,103.066,5,5,1,"Commercials make a lot of money, so they make it easy for people to watch TV.",3,"Everyday, almost.",1,10.102,141.62,142.685,5,5,1,Computers are more and more and it is hard to complete certain things now a days without being online.,2,Much. A lot. Every day almost.,1,47.501,96.995,98.453,5,4,1,People are hooked on caffeine.,2,Not much. Maybe once per week.,1,1,3,25000,Pentecostal / Christian,black,44,4,1,1,"Yes. It seems too long. They say 10 minutes or so, but it seems to take much longer, more like 35 minutes.",Shopping habits.,Yes. I think that it was mainly about shopping habits but some of the questions seemed tricky.,none,1,1
