0,8,4.866666667,7,4.666666667,5.833333333,5.4,1,1,1,4,6,2,4,3,3,8,7,7,8,6,6,3,3,3,3,7,1,8,1,3,1,1,7,3.924,3.924,6.479,1,1,16.015,38.239,44.523,2,3,16.759,16.759,18.034,1,6,15.201,39.552,40.547,2,2,34.41,34.41,48.309,1,6,15.608,15.608,31.629,1,1,32.164,32.164,33.479,1,2,17.127,18.343,60.003,2,3,35.419,35.419,60.004,1,2,18.793,18.793,24.219,1,6,28.037,55.325,56.424,5,7,43.172,54.722,60.006,2,1,1,4,7,6,7,6,7,4,3,6,7,6,7,6,6,6,4,7,4,9,6,1,56.375,156.759,163.823,6,7,2,"The prices of pizza have stayed relatively the same, when using coupons. Any increase would have to account for general food increases because of the economy.",4,We usually order or make a pizza every Friday night. I usually consume 2 pieces and maybe 1 piece of leftovers on Saturday.,1,36.851,118.891,161.009,5,5,1,"The price of tickets is very high. And with all the big screen TV's, it's cheaper and more fun to have their buddies over and watch on the big screen.",4,"During football season we watch our local college team, and on Sundays, my husband has the TV on football. I watch intermitingly - mainly to check how my players on my fantasy football team are doing but I don't have a favorite team.",1,23.969,149.086,149.99,5,5,1,People have more things to do after work - their kids are in more activities. So Americans want to get home faster and don't want to wait for someone else to carpool. Biking takes longer.,4,"I drive back and forth to work by myself most days. My husband and daughter do not work in the same area as me, and a couple of my co-workers, who live in the same are, have different work hours.",1,48.811,136.706,277.06,5,6,1,"Technology is continuing to advance and people want the newest, ""best"" thing - it's becoming a status symbol to own the newest smart phone or iPad or tablet.  Kids growing up on technology use it more and more, so an increasing # find it being part of their normal everyday activities.",4,"I watch about 8 hours a week. I have my favorite shows that I've watched for several years or more and don't tune in to many new shows. I think less people spend time outdoors. And it used to be people visited their family. But with Skype and other forms of media, they can just sit at home and ""talk"" to their family members over the internet instead of in person - that part is good and bad. If it's long distance it's a good way to stay connected to kids, parents, grandkids, etc.   But if they live close, it's still better to stay in touch in person.",1,53.412,99.508,203.204,5,8,1,"The older generation that did not have internet growing up or as young adults are dying, and the population has grown up with or been using the internet at an early age. More % of people have lived with the internet most of their lives now.",2,"I use e-mail at work and at home. I use the internet to search for product reviews, best prices, etc, especially when buying appliances or higher dollar items.",1,32.478,102.941,122.043,6,4,1,"The great amoutn of versatility in flavors, Plus, it doesn't waste coffee, and multiple drinkers in one household can each have their favorite flavor without brewing a large pot.",4,"I don['t drink coffee, but I have used the single cup system for hot and cold tea.",1,2,4,61000,Nazarene,Caucasian,55,8,1,1,no,Maybe to find out how logical a person thinks.,"I'm sure there was. The questions at the beginning I'm sure were related to the puzzles, just not sure what.",no,1,1
0,2,5.8,7,5.333333333,6.166666667,5.1,1,1,1,6,5,6,4,7,5,6,6,5,7,4,6,6,8,6,3,7,1,8,1,3,1,1,1,9.074,9.074,10.343,1,6,13.347,13.347,14.13,1,7,22.64,22.64,23.823,1,8,14.27,14.27,16.844,1,2,7.927,7.927,9.084,1,7,11.035,11.035,16.177,1,5,21.551,21.551,22.374,1,5,13.329,13.329,14.953,1,8,13.319,13.319,15.596,1,4,17.922,17.922,19.543,1,5,16.318,16.318,18.331,1,1,27.357,27.357,28.612,1,1,1,2,2,5,3,6,8,4,5,7,5,4,7,7,5,4,6,2,3,8,9,1,17.887,61.516,97.877,5,7,2,"I think they have gone down especially since some are selling 5 dollar pizzas, the other companies have had to lower their prices some.",1,At least once a week.,1,119.28,179.854,212.577,5,6,1,too expensive to go to games. Annoying to fight the crowds and traffic.,3,only big games so only a couple times a year.,1,31.71,128.495,129.989,6,5,1,"more convenient to drive everyday, than to anticipate the weather, waiting for bus, riding bike etc.",2,I live in the country. It is 15 minutes to work by car. No buses here.,1,46.498,128.692,129.833,5,9,1,technology and lower prices so most people can afford them.,2,watch in the evenings before going to bed. Usually about 2-3 hours a night.,1,46.949,134.687,136.075,5,5,1,Computers in almost every home now. People have a lot of free time. Wish I did.,1,use at work and some for personal use. Not as much as I used to. No time.,1,62.083,125.641,176.56,5,5,1,convenience of those single cup things. But the coffee tastes like instant coffee to me. I would not own one.,1,"I drink a lot of coffee. The one cup thing would not work for me, but would work for someone just wanting a cup before they left for work.",1,2,2,38000,christian,white,55,6,1,1,the puzzles,trends,I don't know,no,1,1
1,2,6.666666667,5,3.666666667,4.333333333,4.35,1,1,1,9,5,7,1,9,7,6,8,6,8,6,7,6,8,7,3,7,1,8,1,3,1,1,7,10.817,10.817,12.795,1,5,40.456,40.456,41.841,1,1,35.162,35.162,36.197,1,1,15.758,15.758,17.12,1,5,18.565,18.565,21.855,1,7,38.513,38.513,44.259,1,1,47.962,47.962,55.106,1,7,12.698,12.698,13.916,1,1,11.71,11.71,13.744,1,1,32.851,43.594,44.332,3,2,16.962,20.881,23.277,2,1,24.412,24.412,38.494,1,1,1,5,7,5,5,7,7,5,5,1,6,7,5,8,5,4,7,9,3,7,7,1,8.109,50.829,85.416,6,5,1,"The price of the products to make the pizza, and the price of the toppings, plus the price to bake it.",1,"I eat pizza once a week, for dinner.",1,34.539,79.587,80.51,5,4,1,too expensive to go in person with ticket prices.,3,"none, don't like it",1,49.277,104.701,105.4,5,1,1,the distance and being lazy,2,"as little as possible, I take public transportation",1,13.634,69.178,69.756,6,3,1,demand for people on the go.,2,I watch around 6 to 8 hours a week.,1,7.021,43.757,61.4,6,7,1,Instant communication and convenience.,1,"I use both each day, for work and personal.",1,9.374,130.256,130.833,18,6,1,"better taste and flavor, also less waiste, versus a larger brewer.",1,"2 cups in the morning, each day. black",1,1,4,59000,none,white,44,1,1,1,the logic shapes did not really make any sense.,"views on people, by the people",no,"not really, except the logic shapes did not have a specific patters or rhythm.",1,0
0,6,4.933333333,7,6,6.5,5.9,1,1,1,5,6,4,5,5,4,6,5,6,3,5,6,4,5,5,3,7,1,8,1,3,1,1,7,22.298,22.298,25.223,1,1,29.182,29.182,31.123,1,3,44.022,44.022,45.764,1,6,35.134,35.134,36.812,1,2,57.553,57.553,58.958,1,7,18.107,18.107,19.04,1,1,34.631,34.631,36.196,1,6,58.09,58.09,58.992,1,7,30.171,30.171,32.608,1,4,22.061,22.061,23.426,1,7,34.235,34.235,36.096,1,3,23.038,23.038,25.476,1,1,1,4,5,5,7,3,7,4,2,6,5,7,7,2,5,8,6,2,7,4,6,1,36.011,101.831,102.585,5,7,1,cost of overhead for the pizza business.,2,While we love pizza we do try to limit it in our diet somewhat.  We do order delivery from time to time as a treat.,1,10.13,50.445,52.039,5,6,2,"price of tickets, travel, dealing with large groups of people.",2,don't watch it at all,1,24.085,101.369,103.092,5,4,1,I live in Portland where it's popular to bike to work.  I think biking to work is not always an easy option depending on distance and dress code for your work place environment.,3,"I work from home, so I don't drive to work.",1,6.519,122.622,124.224,5,5,2,Mobile devices in general have exploded in growth and I expect this to increase.,2,We watch a couple hours in the evenings.  We are very specific about what programs we like to watch so usually watch shows on the DVR.,1,38.314,72.195,133.386,5,9,1,"Once the internet is in the home/work environment, the ease of finding information, entertainment and communication most can't resist!",1,I use it for work and fun on a daily basis.,1,5.995,54.071,54.817,5,8,2,"not really sure, I personally think it's a fad.",2,everyday coffee drinker,1,2,3,30000,none,white,51,3,1,1,"no, it was fun",I have no speculation on what you were studying,maybe but no idea what,no thanks,1,1
0,5,5.266666667,6.333333333,4,5.166666667,3.55,1,1,1,7,7,6,5,3,4,7,7,7,6,6,5,3,3,3,3,7,1,8,1,3,1,1,7,7.885,7.885,11.156,1,1,30.881,32.144,37.384,2,8,30.588,30.588,31.946,1,8,26.005,26.005,26.945,1,2,31.276,31.276,32.464,1,6,26.522,26.522,27.54,1,1,30.028,30.028,31.254,1,7,26.774,26.774,28.154,1,7,16.812,16.812,18.131,1,2,42.305,42.305,43.647,1,7,20.971,20.971,22.182,1,7,22.702,22.702,24.262,1,1,1,4,1,5,9,6,2,3,4,1,8,4,6,7,3,3,6,6,2,3,2,1,35.885,92.965,94.064,6,5,2,  High demand of  delivery of pizza.,2, Eat pizza maybe 1 or 2 days a week.,1,78.884,143.719,208.09,5,3,1,"Because so many people are out of work these days that  not many can afford to even go to a game and also, some think that you get a better view from the tv than a cheap seat in the stadium per say.",4,I only really watch it when  teams I like are playing and are shown. I also watch the playoffs.,1,54.62,202.872,204.707,6,4,1,"Its unsafe to ride to work when the bikers have the ""right"" to be on the road with the traffic. If they made bile trails along side all the states highways, then bike riding  would be a great idea to get to work.  If the job was not that far away that is.",3," Where I live, we don't have transportation other than taxi service, so we use the car to commute.",1,71.888,156.354,203.356,5,8,1,The study of  more modern technology  that lets people watch  videos from the devices rather than spending money on a movie.,4," I watch quite a bit of tv, especially series shows that are on. I also watch a few movies, but not as much as tv programs themselves.",1,57.582,106.414,107.575,5,6,1, The ease of finding any kind of information in a short amount of time.,1,I use the internet and email daily.,1,54.036,123.486,126.605,6,5,2,It takes less time to make a single cup that it does a  pot of coffee.,1,I drink 2 - 3 cups of coffee a day.,1,2,2,0,rather not say,white,59,5,1,1, The shapes  part of the survey., I really don't know., Have no idea.,no,1,1
0,7,5.533333333,8.333333333,5.333333333,6.833333333,4.65,1,1,1,6,9,4,2,5,5,6,3,8,7,4,8,5,7,4,3,7,1,8,1,3,1,1,7,10.386,10.386,11.527,1,1,18.733,19.541,21.438,2,3,20.134,20.134,22.766,1,6,35.182,35.182,37.812,1,2,17.546,17.546,19.273,1,6,46.375,46.375,47.185,1,1,19.682,21.368,22.534,2,5,19.867,19.867,20.772,1,3,7.532,7.532,8.588,1,3,8.531,8.531,9.674,1,2,31.775,31.775,32.806,1,1,17.44,17.44,18.611,1,1,1,4,3,5,4,7,7,7,8,1,7,5,5,9,4,8,5,5,5,9,7,1,11.921,27.177,27.828,5,9,2,Price of ingredients.,4,I love pizza!,1,28.724,44.601,61.008,5,7,1,Too expensive to go to a game. Don't live near a football stadium.,1,I do not watch football.,1,50.534,134.66,135.573,7,4,1,"People don't want to be sweaty when they get to work from bike riding. It can be dangerous, especially during the morning and evenin commute.  It may take longer to bike to work than to drive.  Many Americans live in rural or suburban areas where it is not convenient to bike to work. Some people may work a substantial distance from where they live.",1,I drive to work by myself.,1,28.762,58.707,66.936,5,7,1,technology advancements.,4,We rarely watch live TV but watch shows recorded on the dvr or on the internet.,1,24.872,38.837,43.175,5,9,1,More access to computers.,1,Use it daily for both work and personal use.,1,18.222,27.146,48.864,5,5,1,Convenience and affordable nature of devices like the Keurig.,4,I do not drink coffee.,1,2,5,80000,Catholic,White,31,5,1,1,No,How well you do on non-verbal tasks compared to how well you use/rate language,Probably but I'm not sure what,No,1,1
0,3,7.4,9,5,7,4.6,1,1,1,9,9,8,5,9,9,8,9,9,3,9,1,5,9,9,3,7,1,8,1,3,1,1,7,10.405,14.486,19.574,2,1,8.191,13.704,17.346,2,1,13.141,31.102,59.705,3,2,27.473,27.473,34.184,1,5,22.793,22.793,23.741,1,7,20.846,20.846,22.064,1,5,18.802,18.802,24.635,1,5,11.597,11.597,12.459,1,6,17.906,17.906,19.426,1,4,11.835,11.835,13.444,1,2,12.679,12.679,14.598,1,7,22.404,22.404,24.148,1,1,1,3,6,9,9,9,7,1,5,1,9,5,1,8,9,9,5,3,9,5,9,1,43.833,67.886,89.359,6,9,1,because the demand for them,4,1 a month,1,39.957,115.086,116.907,8,9,1,Because of the game ticket prices and because of the high definition tv's available today.,4,watch as much as I can,1,44.33,87.262,87.942,5,1,1,to far to ride a bike,4,I am disabled but do drive,1,56.498,135.562,136.638,7,9,1,phones that cam stream live tv also computers and all hand held devices,4,3 to 4 hours a day,1,58.4,92.474,151.389,5,9,1,new smart phones plus a person almost has to use the internet today.,2,i use them both daily,1,64.194,105.806,123.342,5,5,1,able to control the flvor and richness better.,4,3 cups in the morning daily,1,1,2,23000,christain,white,51,4,1,1,no,perception?,I believe so but not sure what that is,no,1,1
1,1,4.666666667,7,6.666666667,6.833333333,4.95,1,1,1,5,4,3,3,1,4,5,3,5,7,7,6,5,6,6,6,3,1,8,1,5,1,1,4,19.331,19.331,20.499,1,7,11.351,11.351,19.254,1,4,5.263,13.505,17.075,4,2,0.92,8.905,13.18,2,5,6.673,9.01,14.204,2,6,3.617,6.927,11.181,2,1,4.785,4.785,7.72,1,2,3.719,6.13,8.431,2,1,2.886,2.886,3.78,1,3,4.616,4.616,5.856,1,4,4.668,4.668,8.751,1,1,2.823,3.778,9.399,3,1,1,4,6,4,6,4,6,4,4,4,5,4,6,6,5,3,5,6,5,8,6,1,24.177,74.207,75.306,7,5,1,The demand for the is low.,3,I probably eat pizza once a month.,1,4.146,27.863,50.812,5,9,1,Expensive.,4,I am a avid NFL football watcher. Big Miami Dolphins fan.,1,9.269,30.732,31.621,6,6,1,It's a safety issue.,3,I drive to work each day.,1,5.7,41.283,41.629,7,7,1,More and more people are making videos.,3,I watch a decent amount of TV.,1,7.582,43.186,43.872,5,9,1,As technology gets better the amount of people who use it grows.,2,I use the internet and e-mail everyday,1,268.934,292.786,293.501,4,5,1,It's popular because of the amount of caffeine.,4,I don't drink coffee,1,1,4,50000,Catholic,White,25,7,1,1,No.,Common core issues with the American population.,I don't think so.,Great study!,1,0
0,4,6.333333333,5.333333333,6.333333333,5.833333333,4.4,1,1,1,8,5,7,5,5,5,5,7,7,5,8,7,7,7,7,3,7,1,8,1,3,1,1,7,1.799,16.753,18.289,3,2,2.09,48.343,50.664,3,4,1.618,55.686,58.479,5,4,2.228,26.475,30.18,3,2,1.243,35.47,37.509,2,7,1.366,33.378,35.703,2,1,1.491,53.402,55.353,3,8,1.396,59.842,60.002,2,3,25.512,30.74,33.243,3,3,18.406,28.181,30.716,3,6,2.079,35.198,37.473,3,2,22.993,24.144,26.866,2,1,1,5,5,5,8,5,7,2,5,4,7,5,5,8,5,6,5,5,5,4,7,1,38.938,109.832,111.512,9,7,1,cost of ingredients and labor,2,minimal at best.,1,10.136,102.202,103.743,9,9,2,cost of tickets,2,Computer screen,1,39.352,80.954,82.639,9,3,1,distance to work,2,I rent cars,1,52.994,155.822,157.496,11,4,1,profit from both the programming and the devices,2,Dvr. not live,1,52.49,192.443,194.222,11,5,1,population growth,1,I use search engines every day. I e-mail occasionally. My primary form of communication is texting.,1,26.746,73.559,74.549,10,7,1,better coffee. little waste.,1,one cup per day,1,1,4,16800,non,white,62,6,1,1,no,not really sure,I am sure there is. I have no idea,no,1,1
0,3,6.133333333,5.666666667,6,5.833333333,5.1,1,1,1,7,7,6,4,5,6,6,9,8,7,7,5,5,5,5,3,7,1,8,1,3,1,1,7,15.123,27.434,28.366,2,1,3.564,18.603,19.31,3,7,25.224,25.224,26.082,1,4,9.237,13.413,14.967,2,7,2.457,2.457,4.668,1,7,3.164,3.164,4.279,1,5,10.66,10.66,11.847,1,5,4.546,6.21,6.717,2,3,3.127,3.127,4.201,1, ,0,0,60.019,0, ,27.116,27.412,60.049,2, ,0,0,60.065,0,1,1,4,4,6,6,6,7,5,5,4,6,7,6,5,5,5,6,5,5,6,5,1,1.282,107.105,107.949,19,5,1,I think the consumption level of pizza accounts for the prices.,2,"I eat pizza, on average, about 2-3 times a month.",1,134.875,186.176,213.468,7,7,1,I believe the price of tickets to attend games is a major factor of why more people are not viewing the games live.,1,"I occasionally watch football on television with friends, usually in a bar or other social event.",1,24.719,170.589,202.448,18,6,1,"I think the accessibility of people using their own vehicles to drive to work and get their quickly accounts for less bike usage.  Many people want to get to work feeling refreshed, not sweaty and tired.",1,"I drive everywhere I have to go, including to work.  I like the ease and quickness of being able to get to one place and another, without having to rely on someone else's schedule or time.",1,15.062,112.107,112.943,10,5,1,"I think that the more and more access we have to sites such as Netflix, or movie rental boxes such as Red Box, make it easier for people to be able to catch up on, or view things at their own pace, on their own time.  The more access we have, the more people will use it.",2,"I watch TV on a daily basis while at home on my down time, usually before going to bed after all of my tasks for the day are finished.",1,62.179,130.119,174.387,20,7,1,I think the ease and at-your-foot access to so much knowledge is a popular idea and strikes the interest of people who never used to use these things before.,1,"I use both my email and internet searches on a daily basis, usually multiple times a day.",1,88.222,175.683,176.183,5,5,1,I think the ease at which coffee is made makes the single cup brew more appealing to coffee drinkers.  It also allows for multiple people to drink a variety of different types and flavored coffees.,1,"I personally only like drinking iced coffee from one particular place, aside from that I do not drink coffee regularly at home.",1,2,4,42000,Catholic,Caucasian,27,4,1,1,Not at all.,How people follow rules.,No.,Not at this time.,1,1
0,2,5.4,5,5,5,4.6,1,1,1,7,7,5,5,5,5,5,7,5,5,5,5,5,5,5,3,7,1,8,1,3,1,1,7,6.32,6.32,8.93,1,4,25.305,25.305,29.347,1,1,34.569,34.569,42.028,1,8,33.012,38.083,42.653,2,2,18.926,18.926,31.624,1,7,34.145,34.145,35.923,1,5,27.064,27.064,28.194,1,7,42.541,44.365,45.599,2,7,33.836,33.836,35.582,1,7,34.248,34.248,38.626,1,8,15.363,15.363,17.269,1,6,44.949,44.949,46.439,1,1,1,6,1,5,4,7,6,7,6,3,5,5,6,8,4,8,5,6,4,6,6,1,10.872,84.567,92.155,6,5,1,The high demand for it,4,I eat pizza atleast once a week. /,1,263.48,278.639,286.845,5,5,2,Financial situations,4,I don't watch football at all.,1,5.534,88.228,88.811,6,5,2,"Most people are becoming more environmentally conscious and choosing to ride bikes or carpool. I also feel that if you live in a large city it would be easier to commute on a bike, instead of fighting traffic.",4,"I work from home, so only go to town for things I need or to run errands. I do not drive everyday.",1,2.838,70.334,80.746,6,5,1,"The growing available devices are readily available for all different prices, and it is more convenient to have a mobile device than just your tv. People don't spend all their time at home in front of the tv. Now we can take entertainment on the go.",4,I watch TV a little each day.,1,235.58,313.748,314.522,5,5,1,"The internet and computers have become more readily available to more people from different financial brackets, making it more easily attainable.",3,"I use email and internet everyday, several times a day, as I do technical support over the phone.",1,3.233,18.072,49.206,5,5,1,"It is fresher than making a whole pot and letting it sit for so long. With people on the go, the single cup brew is effective and not wasteful.",4,I drink coffee daily.,1,2,3,32000,none,white,28,5,1,1,no not at all,Entertainment and the way people use it,not sure,Interesting study! Thanks for allowing me to participate!,1,1
0,4,6.666666667,6.333333333,3.333333333,4.833333333,5.3,1,1,1,9,9,9,5,1,5,7,5,9,9,8,9,5,5,5,3,7,1,8,1,3,1,1,8,13.347,13.347,15.372,1,1,41.178,41.178,45.947,1,7,33.201,33.201,57.776,1,6,26.293,26.293,43.634,1,2,52.762,52.762,58.64,1,6,23.056,23.056,24.858,1,5,34.819,34.819,36.173,1,5,39.978,39.978,40.877,1,7,30.967,30.967,32.541,1,1,38.501,38.501,40.687,1,8,30.016,48.574,49.876,3,1,27.494,27.494,32.26,1,1,1,5,7,9,9,5,8,5,6,3,8,7,7,9,9,7,9,2,5,9,7,1,51.789,112.385,113.299,7,1,1,Demand,4,Maybe once  a month.,1,73.069,183.51,184.422,7,2,1,"High cost of tickets, convenience of watching at home.",4,"Not a fan, don't watch",1,127.733,284.943,286.527,5,1,1,"Laziness, health reasons, and/or weather conditions.",3,"Commute on rapid rail, unless I will be working late.  Drive on weekends.",1,99.526,252.694,254.399,5,9,1,"Demand, technology.",4,"Varies, but averages about 6 hours a week.",1,167.491,279.733,323.294,5,9,1,"Technology.  It's also more affordable, and there are many more providers of service.",2,"Use both daily, extensively",1,32.561,67.147,110.875,5,7,2,"Convenience, selection.",4,One cup per day,1,2,3,143000,Catholic,Black,69,5,1,1,"Yes, the patterns threw me!",Comprehension of shapes,N/A,No,1,1
0,4,8.133333333,9,6.333333333,7.666666667,4.65,1,1,1,9,8,9,6,9,8,8,8,9,9,8,7,8,9,7,3,7,1,8,1,3,1,1,7,4.508,5.068,7.277,2,1,11.524,11.524,13.813,1,4,9.044,50.603,54.332,6,6,42.1,42.1,42.886,1,8,54.09,54.09,55.147,1,7,30.609,50.032,53.434,5,1,12.683,12.683,36.085,1,2,12.258,35.867,39.027,3,8,19.628,35.988,37.173,2,3,27.231,27.231,28.362,1,4,17.281,18.497,18.787,2,2,11.766,11.766,18.511,1,1,1,4,3,5,3,6,6,4,8,3,5,4,5,8,4,6,4,4,5,8,8,1,63.236,450.153,468.485,13,9,1,"I would say that's kind of subjective, pizza ranges in price form 3 dollars to 20 dollars a pie so its mainly the quality of the ingredients and the cost of those ingredients that determines the price.",2,I love it. I would eat it for every meal if I could.,1,23.108,90.771,91.302,7,5,2,Because it is really really expensive to go to games in person.,4,I do not watch football at all I think it is stupid.,1,7.874,71.992,72.563,6,5,1,Because most people work very far from home.,1,I only drive to the grocery store. I do not drive to work since I work at home.,1,61.104,260.742,261.29,12,9,1,Over time the cost of these devices is less and therefore more people can afford them.,2,I only watch movies. sometimes I might watch a few tv series type shows off the internet. generally only for about an hour or two. a day.,1,22.165,94.043,95.71,9,9,1,There are more people in general and there are more areas that are offering broad band than ever before.,1,I use it every day almost every day.,1,11.241,76.632,79.522,7,9,1,convenience and it is less wasteful.,1,I drink it when I have to be awake early in the morning and it is noce to drink it when I am reading because I have a tendancy to nod off when reading a book.,1,1,3,20000,Spiritual,White,30,5,1,1,No,Not sure. It was three different studies but they may be connected somehow although I don'y know why.,Well maybe it seems that this might not have been three different studies but one study with three parts.,No.,1,1
0,3,6.066666667,6,3.666666667,4.833333333,5,1,1,1,9,7,7,5,2,1,6,7,7,8,9,4,3,8,8,3,7,1,8,1,3,1,1,7,7.643,7.643,8.665,1,4,16.451,23.154,25.091,3,3,17.823,17.823,19.628,1,8,11.164,11.929,13.291,2,4,19.186,19.186,20.518,1,1,16.359,17.407,17.993,2,5,15.959,19.235,23.168,2,6,21.115,22.243,23.687,2,3,16.232,16.232,20.906,1,6,17.222,17.222,18.293,1,2,14.384,14.384,15.879,1,5,14.962,15.728,16.657,2,1,1,4,1,4,3,6,6,8,8,4,6,4,6,4,3,6,7,3,6,9,6,1,17.947,59.242,60.344,5,6,2,The cost of food and gas prices are higher.,1,I share one pizza per week with my family.,1,12.971,47.18,47.899,5,4,2,No one likes how there are so many stops in game play and commercials.,1,I watch football only when my team is playing.,1,61.286,110.314,111.357,6,4,1,They work far away from home.,1,"I don't work, but use my vehicle for errands and outings about 4 times a week.",1,47.826,85.013,101.389,5,5,1,They are more portable and have more shows available.  Plus you can stop/watch it at any time.,1,I watch about 15 hours of TV per week.,1,36.045,81.744,83.199,5,7,1,Smart phones and tablets make searching and emailing more convenient and faster.,1,I use the internet every day from my smart phone.  I don't search as much as e-mail.,1,25.407,56.17,57.221,5,3,1,It is portable and quick.  Plus there are many different varieties and flavors.,1,I dislike coffee.,1,2,3,90000,Agnostic,Caucasian,33,5,1,1,No,I honestly have no idea.,I have no idea.,No,1,1
0,4,6.4,7.333333333,6.333333333,6.833333333,5.15,1,1,1,9,8,4,7,2,8,3,7,8,7,8,6,7,7,5,3,7,1,8,1,3,1,1,7,5.043,17.278,19.122,2,1,19.74,19.74,21.498,1,5,33.962,33.962,36.016,1,6,14.442,14.442,16.432,1,8,18.844,18.844,20.097,1,6,45.404,45.404,51.803,1,1,39.615,39.615,42.467,1,7,17.312,17.312,18.885,1,5,14.139,14.139,15.196,1,4,9.985,9.985,11.792,1,5,32.94,35.066,36.148,2, ,0,0,60.002,0,1,1,4,6,6,6,1,7,6,4,4,5,2,5,7,5,7,6,5,3,5,5,1,19.133,113.799,135.885,8,6,1,Pizza is cheap and quick which is why so many Americans go first for that.,3,I don't eat it often.,1,56.503,105.231,106.438,7,7,2,People can't afford to pay for tickets to see a game live.,1,I watch it occasionally at home on the TV.,1,25.595,73.997,75.019,6,5,1,Riding a bike will take you longer to get to work and once there you'll be tired.,2,I drive 3 times a week or less.,1,32.415,92.193,93.264,5,7,1,It makes it easier for people to watch shows they are unable to watch when it airs.,1,I watch about 8-10 hours a week from a DVR.,1,30.559,84.591,86.521,7,9,1,Using the internet is easier and a lot faster. Everything you need is at your fingertips. Sending a email to say hellp takes a couple minutes.,1,I use both daily.,1,37.257,102.701,103.87,5,7,1,The single cup brewer is better in the long run so you make enough coffee for one cup which is what you will drink. Most people make a whole pot and then it gets wasted.,2,Daily!,1,2,3,35000,Hindu,Asian,32,5,1,1,No,Not sure,"Yes, if we can figure out patterns",no,1,1
